"schema_name","table_name","columns"
"imp_kfm_ul","REORGLiquidationInfo","ID субъекта, БИН правопреемника, Орган, принявший решение, Дата приказа, Номер приказа, Дата прекращения деятельности, Номер решения суда, Код основания ликвидации, Код типа реаорганизации, Код типа ликвидации, ID слоя, Наименование правопреемника"
"imp_kfm_ul","REORGactivities","ID субъекта, Код, Наименование на русском, Наименование на казахском, ID слоя"
"imp_kfm_ul","REORGactivitiesACT","Наименование на русском, Код, ID слоя, ID субъекта, Наименование на казахском"
"imp_kfm_ul","REORGaddress","Номер строения, ID субъекта, ID слоя, Регистрационный код адреса, Почтовый индекс, Код КАТО, Идентификатор АТЕ с ИС АР, код геонима по ИС АР, Область на русском языке, Область на государственном языке, Район на русском языке, Район на государственном языке, Сельский округ на русском языке, Сельский округ на государственном, Населенный пункт на русском языке, Населенный пункт на государственн, Название улицы на русском языке, Название улицы на государственном, Тип строения, Номер блока, Номер корпуса, Тип помещения, Номер помещения, Номер офиса Не входящий в РКА"
"imp_kfm_ul","REORGclassificationInfo","ID слоя, Способ образования, Код формы собственности, Коммерческая организация?, Код типа фонда, Код типа государственного предпри, Участие лица без гражданства?, Участие иностранных инвесторов?, Международная организация?, Дочерняя организация?, БИН субъекта, из которого выделил, является государственным органом?, Код статуса РО/ОО, Код типа частного предприниматель, Субъект предпринимательства?, ID субъекта"
"imp_kfm_ul","REORGfoundersFl","Код страны гражданства, Отчество, Сумма вклада тг, Доля вклада проц, ID слоя, Код отношения к гражданству, Код страны постоянного местожител, ИИН, Налоговый номер в стране инкорпор, Фамилия, Имя, ID субъекта"
"imp_kfm_ul","REORGfoundersInfo","В том числе юридических лиц, В том числе физических лиц, ID слоя, ID субъекта, Количество участников, учредителе"
"imp_kfm_ul","REORGfoundersUl","ID субъекта, Сумма вклада тг, Вид деятельности для иностранных , Полное наименование на русском яз, Дата (пере)регистрации, Налоговый номер в стране инкорпор, БИН, Регистрационный номер в стране ин, Код страны инкорпорации, Является резидентом РК?, Доля вклада проц, ID слоя"
"imp_kfm_ul","REORGheadOrgInfo","Вид деятельности для иностранных , ID субъекта, ID слоя, Является резидентом РК?, Код страны инкорпорации, БИН, Регистрационный номер в стране ин, Налоговый номер в стране инкорпор, Дата (пере)регистрации, Полное наименование на русском яз"
"imp_kfm_ul","REORGhistoryActivities","Наименование на казахском, ID субъекта, ID слоя, Код, Наименование на русском"
"imp_kfm_ul","REORGhistoryActivitiesACT","Наименование на русском, ID субъекта, ID слоя, Код, Наименование на казахском"
"imp_kfm_ul","REORGhistoryActualStat","адрес на государственном языке, Дата получения актуализации ОКЭД, адрес на русском языке, Код КАТО, Регистрационный код адреса, Признак активности (ситуационный , Размерность организации, ID слоя, ID субъекта"
"imp_kfm_ul","REORGhistoryAddress","Название улицы на государственном, Тип строения, Номер строения, Код КАТО, Почтовый индекс, Регистрационный код адреса, ID слоя, Идентификатор АТЕ с ИС АР, ID субъекта, код геонима по ИС АР, Область на русском языке, Область на государственном языке, Район на русском языке, Район на государственном языке, Сельский округ на русском языке, Сельский округ на государственном, Населенный пункт на русском языке, Номер офиса Не входящий в РКА, Номер помещения, Тип помещения, Номер корпуса, Номер блока, Населенный пункт на государственн, Название улицы на русском языке"
"imp_kfm_ul","REORGhistoryAuthCapital","Доля частного капитала в процента, Доля частного капитала тг, Доля гос-го капитала в процентах, Доля гос-го капитала в тг, УК всего тг, ID слоя, ID субъекта"
"imp_kfm_ul","REORGhistoryClassificationInfo","Коммерческая организация?, Код типа фонда, Код типа государственного предпри, Участие лица без гражданства?, Участие иностранных инвесторов?, Международная организация?, Дочерняя организация?, Код типа частного предприниматель, Субъект предпринимательства?, ID субъекта, ID слоя, Способ образования, Код формы собственности, БИН субъекта, из которого выделил, является государственным органом?, Код статуса РО/ОО"
"imp_kfm_ul","REORGhistoryFoundersFl","Отчество, Имя, Фамилия, Налоговый номер в стране инкорпор, ИИН, Доля вклада проц, ID слоя, Код отношения к гражданству, Код страны гражданства, ID субъекта, Код страны постоянного местожител, Сумма вклада тг"
"imp_kfm_ul","REORGhistoryFoundersInfo","В том числе юридических лиц, ID субъекта, ID слоя, Количество участников, учредителе, В том числе физических лиц"
"imp_kfm_ul","REORGhistoryFoundersUl","ID слоя, ID субъекта, Регистрационный номер в стране ин, Доля вклада проц, Сумма вклада тг, Вид деятельности для иностранных , Полное наименование на русском яз, Дата (пере)регистрации, Налоговый номер в стране инкорпор, БИН, Код страны инкорпорации, Является резидентом РК?"
"imp_kfm_ul","REORGhistoryHeadOrgInfo","Вид деятельности для иностранных , Дата (пере)регистрации, Налоговый номер в стране инкорпор, Регистрационный номер в стране ин, БИН, Код страны инкорпорации, Является резидентом РК?, ID слоя, ID субъекта, Полное наименование на русском яз"
"imp_kfm_ul","REORGhistoryIdentificationAddInfo","Сокращенное наименование на госуд, Признан налоговым органом бездейс, Ожидаемая численность занятых чел, Сокращенное наименование на русск, Регистрационный номер субъекта, Регистрирующий орган, ID слоя, ID субъекта"
"imp_kfm_ul","REORGhistoryLeaderInfo","Код страны постоянного местожител, ID субъекта, ID слоя, Код должности руководителя, Дата назначения на должность, Дата отстранения от должности, Дата утраты силы назначения на до, Код отношения к гражданству, Код страны гражданства, ИИН, Налоговый номер в стране инкорпор, Фамилия, Имя, Отчество"
"imp_kfm_ul","REORGhistoryLiquidationInfo","Дата приказа, Номер приказа, Дата прекращения деятельности, Номер решения суда, Код основания ликвидации, Код типа реаорганизации, Код типа ликвидации, ID слоя, ID субъекта, Наименование правопреемника, БИН правопреемника, Орган, принявший решение"
"imp_kfm_ul","REORGidentificationAddInfo","Сокращенное наименование на русск, Сокращенное наименование на госуд, Признан налоговым органом бездейс, Ожидаемая численность занятых чел, Регистрационный номер субъекта, Регистрирующий орган, ID слоя, ID субъекта"
"imp_kfm_ul","REORGidentificationInfo","ID субъекта, Статус записи, Эл почта, Телефон, Полное наименование на государств, Полное наименование на русском яз, Код организационно-правовой формы, Код формы организации, Дата регистрационного действия, Код регистрационного действия, Код статуса субъекта, БИН субъекта, ID слоя"
"imp_kfm_ul","REORGleaderInfo","Дата отстранения от должности, ID субъекта, ID слоя, Код должности руководителя, Дата назначения на должность, Дата утраты силы назначения на до, Код отношения к гражданству, Код страны гражданства, Код страны постоянного местожител, ИИН, Налоговый номер в стране инкорпор, Фамилия, Имя, Отчество"
"imp_kfm_ul","REORGztFaces","Код регистрационного действия, Статус записи, Эл почта, Телефон, БИН субъекта, ID слоя, ID субъекта, Полное наименование на государств, Полное наименование на русском яз, Код организационно-правовой формы, Код формы организации, Дата регистрационного действия, Код статуса субъекта"
"imp_kfm_ul","activities","Наименование на казахском, ID субъекта, ID слоя, Код, Наименование на русском"
"imp_kfm_ul","activitiesACT","Код, Наименование на русском, Наименование на казахском, ID субъекта, ID слоя"
"imp_kfm_ul","address","Сельский округ на русском языке, Населенный пункт на русском языке, Населенный пункт на государственн, Название улицы на русском языке, Название улицы на государственном, Тип строения, Номер строения, Сельский округ на государственном, Область на русском языке, Область на государственном языке, Район на русском языке, Район на государственном языке, Почтовый индекс, Код КАТО, Идентификатор АТЕ с ИС АР, код геонима по ИС АР, ID субъекта, ID слоя, Регистрационный код адреса, Номер офиса Не входящий в РКА, Номер помещения, Тип помещения, Номер корпуса, Номер блока"
"imp_kfm_ul","classificationInfo","ID слоя, Субъект предпринимательства?, Коммерческая организация?, Код формы собственности, БИН субъекта, из которого выделилс, является государственным органом?, Код статуса РО/ОО, Код типа фонда, Код типа государственного предпри, Участие лица без гражданства?, ID субъекта, Дочерняя организация?, Участие иностранных инвесторов?, Код типа частного предприниматель, Международная организация?, Способ образования"
"imp_kfm_ul","foundersFl","ID субъекта, Доля вклада проц, Сумма вклада тг, Отчество, Имя, Фамилия, Налоговый номер в стране инкорпор, ИИН, Код страны постоянного местожител, Код страны гражданства, Код отношения к гражданству, ID слоя"
"imp_kfm_ul","foundersInfo","ID слоя, Количество участников, учредителе, В том числе физических лиц, В том числе юридических лиц, ID субъекта"
"imp_kfm_ul","foundersUl","ID слоя, Является резидентом РК?, Код страны инкорпорации, БИН, Регистрационный номер в стране ин, Налоговый номер в стране инкорпор, Полное наименование на русском яз, Дата (пере)регистрации, Вид деятельности для иностранных , Сумма вклада тг, Доля вклада проц, ID субъекта"
"imp_kfm_ul","headOrgInfo","Полное наименование на русском яз, ID субъекта, ID слоя, Является резидентом РК?, Код страны инкорпорации, БИН, Регистрационный номер в стране ин, Налоговый номер в стране инкорпор, Вид деятельности для иностранных , Дата (пере)регистрации"
"imp_kfm_ul","historyActivities","Наименование на русском, Наименование на казахском, Код, ID слоя, ID субъекта"
"imp_kfm_ul","historyActivitiesACT","Код, Наименование на русском, Наименование на казахском, ID субъекта, ID слоя"
"imp_kfm_ul","historyActualStat","адрес на государственном языкеДат, Размерность организации, ID субъекта, адрес на русском языке, ID слоя, Код КАТО, Регистрационный код адреса, Признак активности (ситуационный , Дата получения актуализации ОКЭД"
"imp_kfm_ul","historyAddress","Район на государственном языке, Район на русском языке, Область на государственном языке, Область на русском языке, код геонима по ИС АР, Идентификатор АТЕ с ИС АР, Код КАТО, Почтовый индекс, Номер офиса Не входящий в РКА, Номер помещения, Тип помещения, Номер корпуса, Номер блока, Номер строения, Тип строения, Название улицы на государственном, Название улицы на русском языке, Населенный пункт на государственн, Населенный пункт на русском языке, Сельский округ на государственном, Сельский округ на русском языке, ID субъекта, ID слоя, Регистрационный код адреса"
"imp_kfm_ul","historyAuthCapital","УК всего тг, Доля гос-го капитала в тг, Доля гос-го капитала в процентах, Доля частного капитала тг, Доля частного капитала в процента, ID субъекта, ID слоя"
"imp_kfm_ul","historyClassificationInfo","Способ образования, ID субъекта, ID слоя, Код формы собственности, Коммерческая организация?, Субъект предпринимательства?, Код типа частного предприниматель, Дочерняя организация?, Международная организация?, Участие иностранных инвесторов?, Участие лица без гражданства?, Код типа государственного предпри, Код типа фонда, Код статуса РО/ОО, является государственным органом?, БИН субъекта, из которого выделилс"
"imp_kfm_ul","historyFoundersFl","Имя, Код отношения к гражданству, Доля вклада проц, Сумма вклада тг, ID субъекта, ID слоя, Отчество, Код страны гражданства, Код страны постоянного местожител, ИИН, Налоговый номер в стране инкорпор, Фамилия"
"imp_kfm_ul","historyFoundersInfo","ID слоя, ID субъекта, Количество участников, учредителе, В том числе физических лиц, В том числе юридических лиц"
"imp_kfm_ul","historyFoundersUl","БИН, ID субъекта, ID слоя, Является резидентом РК?, Код страны инкорпорации, Регистрационный номер в стране ин, Налоговый номер в стране инкорпор, Дата (пере)регистрации, Полное наименование на русском яз, Вид деятельности для иностранных , Сумма вклада тг, Доля вклада проц"
"imp_kfm_ul","historyHeadOrgInfo","Является резидентом РК?, Код страны инкорпорации, БИН, Регистрационный номер в стране ин, Налоговый номер в стране инкорпор, ID слоя, ID субъекта, Дата (пере)регистрации, Полное наименование на русском яз, Вид деятельности для иностранных "
"imp_kfm_ul","historyIdentificationAddInfo","Регистрирующий орган, ID субъекта, ID слоя, Регистрационный номер субъекта, Сокращенное наименование на русск, Сокращенное наименование на госуд, Признан налоговым органом бездейс, Ожидаемая численность занятых чел"
"imp_kfm_ul","historyLeaderInfo","Код страны постоянного местожител, ИИН, Налоговый номер в стране инкорпор, Фамилия, Отчество, ID субъекта, Дата утраты силы назначения на дол, Код отношения к гражданству, ID слоя, Код должности руководителя, Дата назначения на должность, Дата отстранения от должности, Код страны гражданства, Имя"
"imp_kfm_ul","historyLiquidationInfo","ID слоя, Наименование правопреемника, БИН правопреемника, Орган, принявший решение, Дата приказа, Номер приказа, Дата прекращения деятельности, Номер решения суда, Код основания ликвидации, Код типа реаорганизации, Код типа ликвидации, ID субъекта"
"imp_kfm_ul","identificationAddInfo","ID субъекта, ID слоя, Регистрирующий орган, Регистрационный номер субъекта, Сокращенное наименование на русск, Сокращенное наименование на госуд, Признан налоговым органом бездейс, Ожидаемая численность занятых чел"
"imp_kfm_ul","identificationInfo","ID субъекта, ID слоя, БИН субъекта, Код статуса субъекта, Код регистрационного действия, Дата регистрационного действия, Код формы организации, Код организационно-правовой формы, Полное наименование на русском яз, Полное наименование на государств, Телефон, Эл почта, Статус записи"
"imp_kfm_ul","leaderInfo","ID слоя, Дата отстранения от должности, Дата утраты силы назначения на до, Код отношения к гражданству, Код страны гражданства, Код страны постоянного местожител, Отчество, ИИН, Налоговый номер в стране инкорпор, Фамилия, ID субъекта, Имя, Код должности руководителя, Дата назначения на должность"
"imp_kfm_ul","mv_ul_dir_founder","iin_dir, iin_founder, bin_org, dir_appointment_date, is_curr_dir, head_position, dir_removal_date, is_curr_founder, id"
"imp_kfm_ul","ul_founder_fl","deposit, id, is_curr, reg_date, bin_org, iin, lastname, firstname, patronymic, share"
"imp_kfm_ul","ul_founder_ul","share, deposit, founder_name_ru, founder_bin, id, bin_org, reg_date, founder_reg_date, is_curr, is_resident"
"imp_kfm_ul","ul_leader","id, is_curr, lastname, reg_date, appointment_date, firstname, removal_date, patronymic, iin, bin_org, ul_status, position_id"
"imp_kfm_ul","ztFaces","Код организационно-правовой формы, Полное наименование на государств, Телефон, Эл почта, Статус записи, ID субъекта, ID слоя, БИН субъекта, Код статуса субъекта, Код регистрационного действия, Дата регистрационного действия, Код формы организации, Полное наименование на русском яз"
"imp_kfm_ul_10.04.24","ActualStat","ID субъекта, Размерность организации, Признак активности (ситуационный , Регистрационный код адреса, Код КАТО, Дата получения актуализации ОКЭД, адрес на русском языке, адрес на государственном языкеДат, ID слоя"
"imp_kfm_ul_10.04.24","AuthCapital","Доля гос-го капитала в процентах, УК всего тг, Доля гос-го капитала в тг, Доля частного капитала тг, Доля частного капитала в процента, ID субъекта, ID слоя"
