"schema_name","table_name","columns"
"imp_kfm_ul_old","REORGhistoryAddress","Район на государственном языке, ID субъекта, ID слоя, Регистрационный код адреса, Почтовый индекс, Код КАТО, Идентификатор АТЕ с ИС АР, код геонима по ИС АР, Область на русском языке, Область на государственном языке, Район на русском языке, Сельский округ на русском языке, Сельский округ на государственном, Населенный пункт на русском языке, Населенный пункт на государственн, Название улицы на русском языке, Название улицы на государственном, Тип строения, Номер строения, Номер блока, Номер корпуса, Тип помещения, Номер помещения, Номер офиса Не входящий в РКА"
"imp_kfm_ul_old","REORGhistoryAuthCapital","Доля гос-го капитала в процентах, Доля частного капитала тг, Доля частного капитала в процента, ID слоя, ID субъекта, УК всего тг, Доля гос-го капитала в тг"
"imp_kfm_ul_old","REORGhistoryClassificationInfo","Код типа частного предприниматель, Дочерняя организация?, Международная организация?, Участие иностранных инвесторов?, Участие лица без гражданства?, Код типа государственного предпри, Код типа фонда, Код статуса РО/ОО, БИН субъекта, из которого выделил, является государственным органом?, ID субъекта, ID слоя, Способ образования, Код формы собственности, Коммерческая организация?, Субъект предпринимательства?"
"imp_kfm_ul_old","REORGhistoryFoundersFl","Налоговый номер в стране инкорпор, ID субъекта, ID слоя, Код отношения к гражданству, Код страны гражданства, Код страны постоянного местожител, ИИН, Доля вклада проц, Сумма вклада тг, Отчество, Имя, Фамилия"
"imp_kfm_ul_old","REORGhistoryFoundersInfo","В том числе юридических лиц, В том числе физических лиц, Количество участников, учредителе, ID слоя, ID субъекта"
"imp_kfm_ul_old","REORGhistoryFoundersUl","ID слоя, ID субъекта, Доля вклада проц, Сумма вклада тг, Вид деятельности для иностранных , Полное наименование на русском яз, Налоговый номер в стране инкорпор, Дата (пере)регистрации, Регистрационный номер в стране ин, БИН, Код страны инкорпорации, Является резидентом РК?"
"imp_kfm_ul_old","REORGhistoryHeadOrgInfo","Код страны инкорпорации, Вид деятельности для иностранных , Полное наименование на русском яз, Дата (пере)регистрации, Налоговый номер в стране инкорпор, Регистрационный номер в стране ин, БИН, Является резидентом РК?, ID слоя, ID субъекта"
"imp_kfm_ul_old","REORGhistoryIdentificationAddInfo","ID субъекта, ID слоя, Регистрирующий орган, Ожидаемая численность занятых чел, Признан налоговым органом бездейс, Сокращенное наименование на госуд, Сокращенное наименование на русск, Регистрационный номер субъекта"
"imp_kfm_ul_old","REORGhistoryLeaderInfo","Дата утраты силы назначения на до, Дата отстранения от должности, Дата назначения на должность, Код должности руководителя, ID слоя, ID субъекта, Код страны гражданства, Код страны постоянного местожител, ИИН, Код отношения к гражданству, Налоговый номер в стране инкорпор, Фамилия, Имя, Отчество"
"imp_kfm_ul_old","REORGhistoryLiquidationInfo","ID слоя, ID субъекта, Код типа ликвидации, Код типа реаорганизации, Код основания ликвидации, Номер решения суда, Дата прекращения деятельности, Номер приказа, Дата приказа, Орган, принявший решение, БИН правопреемника, Наименование правопреемника"
"imp_kfm_ul_old","REORGidentificationAddInfo","ID субъекта, ID слоя, Регистрирующий орган, Регистрационный номер субъекта, Сокращенное наименование на русск, Сокращенное наименование на госуд, Признан налоговым органом бездейс, Ожидаемая численность занятых чел"
"imp_kfm_ul_old","REORGidentificationInfo","Код регистрационного действия, ID субъекта, ID слоя, БИН субъекта, Код статуса субъекта, Дата регистрационного действия, Код формы организации, Код организационно-правовой формы, Полное наименование на русском яз, Полное наименование на государств, Телефон, Эл почта, Статус записи"
"imp_kfm_ul_old","REORGleaderInfo","ID субъекта, ID слоя, Код должности руководителя, Дата назначения на должность, Дата отстранения от должности, Дата утраты силы назначения на до, Код отношения к гражданству, Код страны гражданства, Код страны постоянного местожител, ИИН, Налоговый номер в стране инкорпор, Фамилия, Имя, Отчество"
"imp_kfm_ul_old","REORGztFaces","Код статуса субъекта, Код регистрационного действия, Дата регистрационного действия, Код формы организации, Код организационно-правовой формы, Полное наименование на русском яз, Полное наименование на государств, Телефон, Эл почта, Статус записи, ID субъекта, ID слоя, БИН субъекта"
"imp_kfm_ul_old","activities","ID субъекта, Код, Наименование на русском, Наименование на казахском, ID слоя"
"imp_kfm_ul_old","activitiesACT","ID субъекта, Код, Наименование на русском, Наименование на казахском, ID слоя"
"imp_kfm_ul_old","address","Название улицы на государственном, ID субъекта, ID слоя, Регистрационный код адреса, Почтовый индекс, Код КАТО, Идентификатор АТЕ с ИС АР, код геонима по ИС АР, Область на русском языке, Область на государственном языке, Район на русском языке, Район на государственном языке, Сельский округ на русском языке, Сельский округ на государственном, Населенный пункт на русском языке, Населенный пункт на государственн, Название улицы на русском языке, Тип строения, Номер строения, Номер блока, Номер корпуса, Тип помещения, Номер помещения, Номер офиса Не входящий в РКА"
"imp_kfm_ul_old","classificationInfo","Участие лица без гражданства?, Участие иностранных инвесторов?, ID субъекта, ID слоя, Способ образования, Код формы собственности, Коммерческая организация?, Субъект предпринимательства?, Код типа частного предприниматель, Международная организация?, Дочерняя организация?, является государственным органом?, БИН субъекта, из которого выделилс, Код статуса РО/ОО, Код типа фонда, Код типа государственного предпри"
"imp_kfm_ul_old","foundersFl","Имя, Отчество, ID субъекта, Код отношения к гражданству, Код страны гражданства, Код страны постоянного местожител, Сумма вклада тг, Доля вклада проц, ИИН, Налоговый номер в стране инкорпор, Фамилия, ID слоя"
"imp_kfm_ul_old","foundersInfo","В том числе юридических лиц, ID субъекта, ID слоя, Количество участников, учредителе, В том числе физических лиц"
"imp_kfm_ul_old","foundersUl","Является резидентом РК?, ID субъекта, ID слоя, Код страны инкорпорации, БИН, Регистрационный номер в стране ин, Налоговый номер в стране инкорпор, Дата (пере)регистрации, Полное наименование на русском яз, Вид деятельности для иностранных , Сумма вклада тг, Доля вклада проц"
"imp_kfm_ul_old","headOrgInfo","Код страны инкорпорации, Является резидентом РК?, ID слоя, ID субъекта, Дата (пере)регистрации, Полное наименование на русском яз, Вид деятельности для иностранных , Налоговый номер в стране инкорпор, Регистрационный номер в стране ин, БИН"
"imp_kfm_ul_old","historyActivities","Наименование на русском, Наименование на казахском, Код, ID слоя, ID субъекта"
"imp_kfm_ul_old","historyActivitiesACT","ID слоя, Наименование на русском, Наименование на казахском, ID субъекта, Код"
"imp_kfm_ul_old","historyActualStat","адрес на государственном языкеДат, ID субъекта, ID слоя, Размерность организации, Признак активности (ситуационный , Дата получения актуализации ОКЭД, Регистрационный код адреса, Код КАТО, адрес на русском языке"
"imp_kfm_ul_old","historyAddress","Тип строения, Номер строения, Номер блока, Номер корпуса, Район на русском языке, Область на государственном языке, Область на русском языке, код геонима по ИС АР, Идентификатор АТЕ с ИС АР, Код КАТО, Почтовый индекс, Регистрационный код адреса, ID слоя, ID субъекта, Тип помещения, Номер помещения, Номер офиса Не входящий в РКА, Район на государственном языке, Сельский округ на русском языке, Сельский округ на государственном, Населенный пункт на русском языке, Населенный пункт на государственн, Название улицы на русском языке, Название улицы на государственном"
"imp_kfm_ul_old","historyAuthCapital","Доля гос-го капитала в процентах, Доля гос-го капитала в тг, УК всего тг, Доля частного капитала тг, ID слоя, ID субъекта, Доля частного капитала в процента"
"imp_kfm_ul_old","historyClassificationInfo","Субъект предпринимательства?, Международная организация?, Участие иностранных инвесторов?, Участие лица без гражданства?, Код типа государственного предпри, Код типа фонда, Код статуса РО/ОО, Способ образования, ID слоя, ID субъекта, является государственным органом?, БИН субъекта, из которого выделилс, Код типа частного предприниматель, Дочерняя организация?, Коммерческая организация?, Код формы собственности"
"imp_kfm_ul_old","historyFoundersFl","Сумма вклада тг, Доля вклада проц, Отчество, Имя, Фамилия, Налоговый номер в стране инкорпор, ИИН, Код страны постоянного местожител, Код страны гражданства, Код отношения к гражданству, ID слоя, ID субъекта"
"imp_kfm_ul_old","historyFoundersInfo","Количество участников, учредителе, ID слоя, В том числе физических лиц, В том числе юридических лиц, ID субъекта"
"imp_kfm_ul_old","historyFoundersUl","Сумма вклада тг, Доля вклада проц, Регистрационный номер в стране ин, БИН, ID слоя, Код страны инкорпорации, Является резидентом РК?, ID субъекта, Налоговый номер в стране инкорпор, Дата (пере)регистрации, Полное наименование на русском яз, Вид деятельности для иностранных "
"imp_kfm_ul_old","historyHeadOrgInfo","Налоговый номер в стране инкорпор, Дата (пере)регистрации, Полное наименование на русском яз, ID слоя, Вид деятельности для иностранных , ID субъекта, Является резидентом РК?, Код страны инкорпорации, БИН, Регистрационный номер в стране ин"
"imp_kfm_ul_old","historyIdentificationAddInfo","Регистрационный номер субъекта, Регистрирующий орган, ID слоя, ID субъекта, Признан налоговым органом бездейс, Ожидаемая численность занятых чел, Сокращенное наименование на госуд, Сокращенное наименование на русск"
"imp_kfm_ul_old","historyLeaderInfo","ID субъекта, Отчество, Имя, Дата назначения на должность, Фамилия, Код должности руководителя, Налоговый номер в стране инкорпор, ИИН, Код страны постоянного местожител, Код страны гражданства, Код отношения к гражданству, Дата утраты силы назначения на дол, Дата отстранения от должности, ID слоя"
"imp_kfm_ul_old","historyLiquidationInfo","Код основания ликвидации, ID субъекта, ID слоя, Код типа ликвидации, Код типа реаорганизации, Номер решения суда, Дата прекращения деятельности, Номер приказа, Дата приказа, Орган, принявший решение, БИН правопреемника, Наименование правопреемника"
"imp_kfm_ul_old","identificationAddInfo","ID субъекта, ID слоя, Регистрирующий орган, Регистрационный номер субъекта, Сокращенное наименование на русск, Сокращенное наименование на госуд, Признан налоговым органом бездейс, Ожидаемая численность занятых чел"
"imp_kfm_ul_old","identificationInfo","Код организационно-правовой формы, Код формы организации, Дата регистрационного действия, Код регистрационного действия, Код статуса субъекта, БИН субъекта, ID слоя, ID субъекта, Статус записи, Эл почта, Телефон, Полное наименование на государств, Полное наименование на русском яз"
"imp_kfm_ul_old","leaderInfo","Налоговый номер в стране инкорпор, Имя, Отчество, ID субъекта, ID слоя, Код должности руководителя, Дата назначения на должность, Дата отстранения от должности, Дата утраты силы назначения на до, Код отношения к гражданству, Код страны гражданства, Код страны постоянного местожител, ИИН, Фамилия"
"imp_kfm_ul_old","mv_reg_address_ul","is_international, is_foreign_investors, is_stateless_person, org_name_kz, reg_addr_region_ru, d_ownership_type, ul_status, reg_addr_region_kz, reg_addr_district_ru, reg_addr_district_kz, layer_id, reg_action_code, reg_addr_rural_district_ru, reg_addr_rural_district_kz, reg_addr_locality_ru, d_org_form, d_org_legal_form, tax_inactive, reg_addr_locality_kz, subject_id, d_ul_formation_type, d_private_enterprise_type, d_state_enterprise_type, d_ul_fund_type, bin, reg_date, reg_addr_street_ru, reg_addr_street_kz, is_government_agency, reg_addr_bulding_num, reg_addr_block_num, reg_addr_builing_body_num, is_active, reg_addr_office, oked_name_ru, oked_name_kz, authorized_capital_total, authorized_capital_gov_share, authorized_capital_private_share, ul_org_reg_number, is_commercial, is_entrepreneurial, is_subsidiary, org_name_ru"
"imp_kfm_ul_old","mv_ul","short_name, bin, full_name_kaz, org_status, org_registration_type, org_form, org_reg_date, legal_form, is_resident, registration_agensy, registration_number, subject_id, layer_id, ul_status, is_upd, full_name_rus, oked, head_organization"
"imp_kfm_ul_old","mv_ul_dir_founder","reg_date, dir_appointment_date, iin_founder, dir_removal_date, bin_org, id, is_curr_dir, ul_status, head_position, deposit, is_curr_founder, iin_dir, share"
"imp_kfm_ul_old","mv_ul_founder_fl","deposit, share, bin_org, iin, is_curr, lastname, firstname, id, patronymic, reg_date"
"imp_kfm_ul_old","mv_ul_founder_ul","founder_name_ru, is_resident, founder_bin, id, founder_reg_date, is_curr, reg_date, bin_org, share, deposit"
"imp_kfm_ul_old","mv_ul_leader","is_curr, position_id, bin_org, appointment_date, reg_date, removal_date, patronymic, firstname, lastname, ul_status, iin, id"
"imp_kfm_ul_old","mv_ul_short_new","org_name, org_region, org_iin_bin"
"imp_kfm_ul_old","ztFaces","Эл почта, Код регистрационного действия, Код статуса субъекта, Дата регистрационного действия, Код формы организации, Код организационно-правовой формы, Полное наименование на русском яз, БИН субъекта, Полное наименование на государств, Телефон, Статус записи, ID слоя, ID субъекта"
"imp_mfca_ul","companies","quarters_num, reg_date, id, bin, oked, country, region, city, form, status, street, house_num, name"
"imp_mfca_ul","directors","id, employee_iin, company_name, company_bin, job_title_ru"
"imp_mfca_ul","founders","fl_founder_patronymic, fl_founder_firstname, fl_founder_lastname, founder_bin, company_name, ul_founder_name, id, company_bin"
"imp_notary","accountant_list","lname, fname, bin, prof, iin"
"imp_notary","advocate_list","license_number, status, iin, fio, license_date"
"imp_notary","auditors_list","auditor_number, status, iin, id"
"imp_notary","bailiff_list","status, license_number, iin"
"imp_risk","bankrot","reason, iin_bin, update_dt, document"
"imp_risk","beneficiaries_list","iin, id, status"
"imp_risk","block_esf","update_dt, end_dt, start_dt, id, iin_bin"
"imp_risk","commodity_producers","id, cnt, status, region, producer, iin_bin, ssp_name, sztp"
"imp_risk","convicts_abroad","court_decision_date, id, entry_date, number, country, qualification, sud_organ, iin, measure"
"imp_risk","convicts_justified","erdr_number, code_started_investiogation, id, investigative_authority, is_iin_upd, is_rab, birth_date, iin, last_name, first_name, patronomyc, reg_date, qualification, severity_code_crime, qualification_code, measure_punishment, code_desicion_by_person, decision_on_person, court_of_first_instance, consider_date_first_instance"
"imp_risk","convicts_justified_update","reg_date, investigative_authority, qualification, severity_code_crime, is_iin_upd, is_rab, patronomyc, measure_punishment, birth_date, code_started_investiogation, iin, consider_date_first_instance, last_name, first_name, erdr_number, decision_on_person, code_desicion_by_person, court_of_first_instance, qualification_code"
"imp_risk","convicts_terminated_by_rehab","patronomyc, investigative_authority_code, investigative_authority, is_find_iin, is_rab, id, erdr_number, iin, qualification_desc, qualification_code, qualificatiob_code_by_11, last_solution_date, qualification_by_11, code_last_solution, last_solution, last_name, first_name, birth_date"
"imp_risk","convicts_terminated_by_rehab_update","patronomyc, erdr_number, code_last_solution, last_solution_date, first_name, last_name, last_solution, qualification_by_11, qualificatiob_code_by_11, qualification_code, qualification_desc, is_rab, is_find_iin, iin, investigative_authority, investigative_authority_code, birth_date"
"imp_risk","criminals","add_info, sentence, crime_code, crime_name, decision, iin_bin, court_dt, court_name, id, update_dt, erdr, treatment"
"imp_risk","criminals_update","erdr, iin_bin, add_info, decision, treatment, crime_name, crime_code, court_dt, sentence, update_dt, court_name"
"imp_risk","disciplinary_misconduct","work_place, iin, measure, position, fabula, organ, id"
"imp_risk","dismissal","order_num, work_place, order_date, id, organ, punishment, iin"
"imp_risk","dormant","taxpayer_name, id, taxpayer_fio, iin_bin, rnn, leader_fio, leader_iin, leader_rnn, order_number, order_date"
"imp_risk","drug_addicts_pfr","source, id, fio, ishod, iin"
"imp_risk","erdr216","bin, reg_dt, body_reg, code_state, erdr, id"
"imp_risk","incapacitated","court, cause, soct, id, iin, date_decision"
"imp_risk","kuis","region, editorial_code, institution, personal_closure_ground, departure_date, conviction_article, arrival_date, period_start, bin, iin, full_name, period_end, id, personal_closure_date"
"imp_risk","mz","disease_code, status_mz, reg, iin, medical_org, id"
"imp_risk","nds","end_dt, start_dt, iin_bin, reason, update_dt, id"
"imp_risk","omn","decision_number, taxpayer_name, leader_fio, id, iin_bin, rnn, leader_iin, leader_rnn, decision_date, taxpayer_fio"
"imp_risk","opg","region, bin, year, name, id, groupe"
"imp_risk","orphans","birth_date, graduation_year, distict, fio, orphanage_name, id, region, iin"
"imp_risk","sudispol","name_of_organ, work_in, middlename_recoverer, addition_category, over_proceeding, grounds_termination, recoverer, return_doc, suspended, protest, date_initiation, debtor_lastname, name_organization, date_termination, iin_recoverer, firstname_recoverer, debtor_firstname, id, debtor_middlename, lastname_recoverer, debtor_iin, debtor_bin, position_work, denied_initiation, amount, category_requirements, number_of_man, name_of_layer"
