"schema_name","table_name","columns"
"imp_kfm_ul_10.04.24","REORGidentificationAddInfo","ID слоя, ID субъекта, Ожидаемая численность занятых чел, Признан налоговым органом бездейс, Сокращенное наименование на госуд, Сокращенное наименование на русск, Регистрационный номер субъекта, Регистрирующий орган"
"imp_kfm_ul_10.04.24","REORGidentificationInfo","Полное наименование на русском яз, Полное наименование на государств, Телефон, Эл почта, Статус записи, Дата регистрационного действия, Код статуса субъекта, БИН субъекта, ID слоя, Код регистрационного действия, ID субъекта, Код формы организации, Код организационно-правовой формы"
"imp_kfm_ul_10.04.24","REORGleaderInfo","ID слоя, Фамилия, Налоговый номер в стране инкорпор, ИИН, Код страны постоянного местожител, Дата назначения на должность, Дата утраты силы назначения на до, Дата отстранения от должности, Код должности руководителя, Код отношения к гражданству, Код страны гражданства, Имя, Отчество, ID субъекта"
"imp_kfm_ul_10.04.24","REORGztFaces","Код статуса субъекта, ID слоя, Код организационно-правовой формы, Код формы организации, Дата регистрационного действия, Код регистрационного действия, БИН субъекта, ID субъекта, Эл почта, Статус записи, Телефон, Полное наименование на государств, Полное наименование на русском яз"
"imp_kfm_ul_10.04.24","activities","ID слоя, Код, Наименование на казахском, Наименование на русском, ID субъекта"
"imp_kfm_ul_10.04.24","activitiesACT","Код, Наименование на казахском, Наименование на русском, ID слоя, ID субъекта"
"imp_kfm_ul_10.04.24","address","ID слоя, Название улицы на русском языке, Название улицы на государственном, Тип строения, Номер строения, Номер блока, Номер корпуса, Тип помещения, Номер помещения, Номер офиса Не входящий в РКА, Почтовый индекс, Регистрационный код адреса, Населенный пункт на русском языке, ID субъекта, Населенный пункт на государственн, Сельский округ на государственном, Сельский округ на русском языке, код геонима по ИС АР, Область на русском языке, Область на государственном языке, Район на русском языке, Район на государственном языке, Идентификатор АТЕ с ИС АР, Код КАТО"
"imp_kfm_ul_10.04.24","classificationInfo","Способ образования, Код формы собственности, Коммерческая организация?, Субъект предпринимательства?, Код типа частного предприниматель, Дочерняя организация?, Международная организация?, Участие иностранных инвесторов?, Участие лица без гражданства?, Код типа государственного предпри, Код типа фонда, Код статуса РО/ОО, является государственным органом?, БИН субъекта, из которого выделилс, ID субъекта, ID слоя"
"imp_kfm_ul_10.04.24","foundersFl","Доля вклада проц, ID субъекта, ID слоя, Код отношения к гражданству, Код страны гражданства, Код страны постоянного местожител, ИИН, Налоговый номер в стране инкорпор, Фамилия, Имя, Отчество, Сумма вклада тг"
"imp_kfm_ul_10.04.24","foundersInfo","В том числе физических лиц, ID субъекта, ID слоя, Количество участников, учредителе, В том числе юридических лиц"
"imp_kfm_ul_10.04.24","foundersUl","Сумма вклада тг, ID субъекта, ID слоя, Является резидентом РК?, Код страны инкорпорации, БИН, Регистрационный номер в стране ин, Налоговый номер в стране инкорпор, Дата (пере)регистрации, Полное наименование на русском яз, Вид деятельности для иностранных , Доля вклада проц"
"imp_kfm_ul_10.04.24","headOrgInfo","Полное наименование на русском яз, ID субъекта, ID слоя, Является резидентом РК?, Код страны инкорпорации, БИН, Регистрационный номер в стране ин, Налоговый номер в стране инкорпор, Дата (пере)регистрации, Вид деятельности для иностранных "
"imp_kfm_ul_10.04.24","historyActivities","Наименование на русском, Наименование на казахском, Код, ID слоя, ID субъекта"
"imp_kfm_ul_10.04.24","historyActivitiesACT","Наименование на казахском, Наименование на русском, ID субъекта, ID слоя, Код"
"imp_kfm_ul_10.04.24","historyActualStat","Признак активности (ситуационный , Регистрационный код адреса, ID слоя, Размерность организации, ID субъекта, Дата получения актуализации ОКЭД, адрес на государственном языкеДат, адрес на русском языке, Код КАТО"
"imp_kfm_ul_10.04.24","historyAddress","Номер офиса Не входящий в РКА, Номер помещения, Тип помещения, Номер корпуса, Номер блока, Номер строения, Тип строения, Название улицы на государственном, Название улицы на русском языке, Населенный пункт на государственн, Населенный пункт на русском языке, Сельский округ на государственном, Сельский округ на русском языке, Район на государственном языке, Район на русском языке, Область на государственном языке, Область на русском языке, код геонима по ИС АР, Идентификатор АТЕ с ИС АР, Код КАТО, Почтовый индекс, Регистрационный код адреса, ID слоя, ID субъекта"
"imp_kfm_ul_10.04.24","historyAuthCapital","Доля гос-го капитала в процентах, Доля частного капитала тг, Доля частного капитала в процента, Доля гос-го капитала в тг, УК всего тг, ID слоя, ID субъекта"
"imp_kfm_ul_10.04.24","historyClassificationInfo","Субъект предпринимательства?, ID субъекта, ID слоя, Способ образования, Код формы собственности, Коммерческая организация?, Код типа частного предприниматель, Дочерняя организация?, Международная организация?, Участие иностранных инвесторов?, Участие лица без гражданства?, Код типа государственного предпри, Код типа фонда, Код статуса РО/ОО, является государственным органом?, БИН субъекта, из которого выделилс"
"imp_kfm_ul_10.04.24","historyFoundersFl","ID слоя, ИИН, Код страны постоянного местожител, Код страны гражданства, Код отношения к гражданству, ID субъекта, Доля вклада проц, Сумма вклада тг, Отчество, Имя, Фамилия, Налоговый номер в стране инкорпор"
"imp_kfm_ul_10.04.24","historyFoundersInfo","В том числе юридических лиц, В том числе физических лиц, Количество участников, учредителе, ID слоя, ID субъекта"
"imp_kfm_ul_10.04.24","historyFoundersUl","Сумма вклада тг, ID субъекта, ID слоя, Является резидентом РК?, Код страны инкорпорации, БИН, Регистрационный номер в стране ин, Налоговый номер в стране инкорпор, Дата (пере)регистрации, Полное наименование на русском яз, Вид деятельности для иностранных , Доля вклада проц"
"imp_kfm_ul_10.04.24","historyHeadOrgInfo","ID слоя, Является резидентом РК?, Код страны инкорпорации, БИН, Регистрационный номер в стране ин, Налоговый номер в стране инкорпор, Дата (пере)регистрации, Полное наименование на русском яз, Вид деятельности для иностранных , ID субъекта"
"imp_kfm_ul_10.04.24","historyIdentificationAddInfo","Регистрационный номер субъекта, Сокращенное наименование на русск, Сокращенное наименование на госуд, Признан налоговым органом бездейс, Ожидаемая численность занятых чел, ID субъекта, ID слоя, Регистрирующий орган"
"imp_kfm_ul_10.04.24","historyLeaderInfo","Налоговый номер в стране инкорпор, ID субъекта, ID слоя, Код должности руководителя, Дата назначения на должность, Дата отстранения от должности, Отчество, Имя, Дата утраты силы назначения на дол, Код отношения к гражданству, Код страны гражданства, Код страны постоянного местожител, Фамилия, ИИН"
"imp_kfm_ul_10.04.24","historyLiquidationInfo","Наименование правопреемника, Орган, принявший решение, Дата приказа, Номер приказа, Дата прекращения деятельности, Код типа реаорганизации, ID субъекта, Код типа ликвидации, Номер решения суда, Код основания ликвидации, ID слоя, БИН правопреемника"
"imp_kfm_ul_10.04.24","identificationAddInfo","ID слоя, Сокращенное наименование на русск, Регистрирующий орган, Регистрационный номер субъекта, Сокращенное наименование на госуд, Ожидаемая численность занятых чел, Признан налоговым органом бездейс, ID субъекта"
"imp_kfm_ul_10.04.24","identificationInfo","Код формы организации, Код организационно-правовой формы, Полное наименование на русском яз, Полное наименование на государств, Эл почта, Телефон, Статус записи, ID субъекта, ID слоя, БИН субъекта, Код статуса субъекта, Код регистрационного действия, Дата регистрационного действия"
"imp_kfm_ul_10.04.24","leaderInfo","ID слоя, ID субъекта, Код должности руководителя, Дата назначения на должность, Дата отстранения от должности, Дата утраты силы назначения на до, Код отношения к гражданству, Код страны гражданства, Код страны постоянного местожител, ИИН, Налоговый номер в стране инкорпор, Фамилия, Имя, Отчество"
"imp_kfm_ul_10.04.24","mv_ul_founder_ul_old","deposit, founder_bin, founder_name_ru, id, is_curr, reg_date, is_resident, bin_org, share, founder_reg_date"
"imp_kfm_ul_10.04.24","mv_ul_short_new","org_iin_bin, org_name, org_region"
"imp_kfm_ul_10.04.24","ul_founder_fl","firstname, iin, bin_org, reg_date, is_curr, id, deposit, share, patronymic, lastname"
"imp_kfm_ul_10.04.24","ul_founder_ul","deposit, founder_bin, bin_org, founder_reg_date, is_curr, id, is_resident, reg_date, founder_name_ru, share"
"imp_kfm_ul_10.04.24","ul_leader","appointment_date, ul_status, patronymic, firstname, position_id, bin_org, iin, reg_date, removal_date, is_curr, id, lastname"
"imp_kfm_ul_10.04.24","ztFaces","ID слоя, Полное наименование на русском яз, Код регистрационного действия, Код организационно-правовой формы, Код формы организации, БИН субъекта, Код статуса субъекта, ID субъекта, Дата регистрационного действия, Полное наименование на государств, Телефон, Эл почта, Статус записи"
"imp_kfm_ul_26.04.2024","ActualStat","ID слоя, Размерность организации, Дата получения актуализации ОКЭД, Признак активности (ситуационный , Регистрационный код адреса, Код КАТО, адрес на русском языке, ID субъекта, адрес на государственном языкеДат"
"imp_kfm_ul_26.04.2024","AuthCapital","Доля частного капитала тг, ID субъекта, ID слоя, УК всего тг, Доля гос-го капитала в тг, Доля гос-го капитала в процентах, Доля частного капитала в процента"
"imp_kfm_ul_26.04.2024","ETL_COLUMN_MAPPING","table_name, source_data_type, destination_data_type, ordinal_position, destination_column_name, source_column_name, table_catalog"
"imp_kfm_ul_26.04.2024","LIQUIDActualStat","Регистрационный код адреса, Код КАТО, адрес на русском языке, адрес на государственном языке, Дата получения актуализации ОКЭД, ID субъекта, ID слоя, Размерность организации, Признак активности (ситуационный "
"imp_kfm_ul_26.04.2024","LIQUIDAuthCapital","Доля гос-го капитала в процентах, Доля частного капитала тг, Доля частного капитала в процента, ID субъекта, ID слоя, УК всего тг, Доля гос-го капитала в тг"
"imp_kfm_ul_26.04.2024","LIQUIDLiquidationInfo","БИН правопреемника, Орган, принявший решение, Номер решения суда, Дата приказа, Код основания ликвидации, Код типа реаорганизации, Номер приказа, Наименование правопреемника, ID субъекта, ID слоя, Код типа ликвидации, Дата прекращения деятельности"
"imp_kfm_ul_26.04.2024","LIQUIDactivities","ID слоя, Наименование на казахском, Наименование на русском, Код, ID субъекта"
"imp_kfm_ul_26.04.2024","LIQUIDactivitiesACT","Наименование на казахском, ID субъекта, ID слоя, Код, Наименование на русском"
"imp_kfm_ul_26.04.2024","LIQUIDaddress","Населенный пункт на государственн, Населенный пункт на русском языке, Сельский округ на государственном, Сельский округ на русском языке, Код КАТО, Район на государственном языке, Район на русском языке, Название улицы на государственном, Тип строения, Номер строения, Номер блока, Номер корпуса, Тип помещения, Номер помещения, Номер офиса Не входящий в РКА, Область на государственном языке, Область на русском языке, код геонима по ИС АР, Идентификатор АТЕ с ИС АР, Почтовый индекс, ID субъекта, ID слоя, Название улицы на русском языке, Регистрационный код адреса"
"imp_kfm_ul_26.04.2024","LIQUIDclassificationInfo","БИН субъекта, из которого выделил, ID субъекта, ID слоя, Способ образования, Код формы собственности, Коммерческая организация?, Субъект предпринимательства?, Код типа частного предприниматель, Дочерняя организация?, Международная организация?, Участие иностранных инвесторов?, Участие лица без гражданства?, Код типа государственного предпри, Код типа фонда, Код статуса РО/ОО, является государственным органом?"
"imp_kfm_ul_26.04.2024","LIQUIDfoundersFl","Фамилия, Имя, Отчество, Доля вклада проц, Сумма вклада тг, ID субъекта, ID слоя, Код отношения к гражданству, Код страны гражданства, Код страны постоянного местожител, ИИН, Налоговый номер в стране инкорпор"
"imp_kfm_ul_26.04.2024","LIQUIDfoundersInfo","В том числе юридических лиц, ID субъекта, ID слоя, Количество участников, учредителе, В том числе физических лиц"
"imp_kfm_ul_26.04.2024","LIQUIDfoundersUl","Доля вклада проц, Является резидентом РК?, ID слоя, ID субъекта, Дата (пере)регистрации, Полное наименование на русском яз, Налоговый номер в стране инкорпор, Регистрационный номер в стране ин, БИН, Код страны инкорпорации, Вид деятельности для иностранных , Сумма вклада тг"
"imp_kfm_ul_26.04.2024","LIQUIDheadOrgInfo","ID субъекта, Вид деятельности для иностранных , Полное наименование на русском яз, Дата (пере)регистрации, Налоговый номер в стране инкорпор, Регистрационный номер в стране ин, БИН, Код страны инкорпорации, Является резидентом РК?, ID слоя"
"imp_kfm_ul_26.04.2024","LIQUIDhistoryActivities","Наименование на казахском, Наименование на русском, Код, ID субъекта, ID слоя"
"imp_kfm_ul_26.04.2024","LIQUIDhistoryActivitiesACT","Код, Наименование на казахском, ID субъекта, ID слоя, Наименование на русском"
"imp_kfm_ul_26.04.2024","LIQUIDhistoryActualStat","Дата получения актуализации ОКЭД, ID слоя, ID субъекта, Размерность организации, Регистрационный код адреса, Признак активности (ситуационный , Код КАТО, адрес на русском языке, адрес на государственном языке"
"imp_kfm_ul_26.04.2024","LIQUIDhistoryAddress","Номер корпуса, ID субъекта, ID слоя, Регистрационный код адреса, Почтовый индекс, Код КАТО, Идентификатор АТЕ с ИС АР, код геонима по ИС АР, Область на русском языке, Область на государственном языке, Район на русском языке, Район на государственном языке, Номер офиса Не входящий в РКА, Номер помещения, Тип помещения, Номер блока, Номер строения, Тип строения, Название улицы на государственном, Название улицы на русском языке, Населенный пункт на государственн, Населенный пункт на русском языке, Сельский округ на государственном, Сельский округ на русском языке"
"imp_kfm_ul_26.04.2024","LIQUIDhistoryAuthCapital","Доля гос-го капитала в процентах, Доля частного капитала в процента, Доля частного капитала тг, Доля гос-го капитала в тг, УК всего тг, ID субъекта, ID слоя"
"imp_kfm_ul_26.04.2024","LIQUIDhistoryClassificationInfo","Участие иностранных инвесторов?, Международная организация?, Дочерняя организация?, БИН субъекта, из которого выделил, является государственным органом?, Код статуса РО/ОО, Код типа фонда, Код типа государственного предпри, Участие лица без гражданства?, ID субъекта, ID слоя, Способ образования, Код формы собственности, Коммерческая организация?, Субъект предпринимательства?, Код типа частного предприниматель"
"imp_kfm_ul_26.04.2024","LIQUIDhistoryFoundersFl","Отчество, Сумма вклада тг, Налоговый номер в стране инкорпор, Фамилия, Имя, Доля вклада проц, ИИН, Код страны постоянного местожител, ID субъекта, ID слоя, Код отношения к гражданству, Код страны гражданства"
"imp_kfm_ul_26.04.2024","LIQUIDhistoryFoundersInfo","ID слоя, Количество участников, учредителе, В том числе физических лиц, В том числе юридических лиц, ID субъекта"
"imp_kfm_ul_26.04.2024","LIQUIDhistoryFoundersUl","Код страны инкорпорации, Полное наименование на русском яз, Вид деятельности для иностранных , Сумма вклада тг, Доля вклада проц, ID субъекта, ID слоя, Является резидентом РК?, Регистрационный номер в стране ин, Налоговый номер в стране инкорпор, Дата (пере)регистрации, БИН"
"imp_kfm_ul_26.04.2024","LIQUIDhistoryHeadOrgInfo","Регистрационный номер в стране ин, Вид деятельности для иностранных , Полное наименование на русском яз, Дата (пере)регистрации, Налоговый номер в стране инкорпор, БИН, Код страны инкорпорации, Является резидентом РК?, ID слоя, ID субъекта"
